{
  "schema_version": "reagent.project-workspace/v0.1",
  "project_id": "project-11111111111111111111111111111111",
  "workspace_id": "workspace-22222222222222222222222222222222",
  "created_at": "2026-08-06T12:00:00Z",
  "desired_manifest_path": ".reagent/desired-manifest.json",
  "installed_lock_path": ".reagent/installed-lock.json",
  "capsules_root": "capsules",
  "artifact_materialization_root": "artifacts/materialized",
  "resource_root": "resources",
  "secret_policy": "PROHIBITED"
}
